"title","publication_date","source","country","summary","url","language"
"Vietnam War: How protest music fueled a movement","Tue, 29 Apr 2025 14:09:00 GMT","Deutsche Welle","Germany","The Vietnam War ended 50 years ago. What role did American protest culture, especially music, play in bringing the conflict to an end?","https://www.dw.com/en/vietnam-war-how-protest-music-fueled-a-movement/a-72321527?maca=en-rss-en-all-1573-xml-mrss","en"
"US study links everyday plastics to heart disease","Tue, 29 Apr 2025 13:38:00 GMT","Deutsche Welle","Germany","Common chemicals found in everyday plastic products may be associated with cardiovascular disease worldwide, with highest impacts in Asia, the Middle East and the Pacific.","https://www.dw.com/en/us-study-links-everyday-plastics-to-heart-disease/a-72379367?maca=en-rss-en-all-1573-xml-mrss","en"
"Brazilian study links ultraprocessed foods to early death","Mon, 28 Apr 2025 15:27:00 GMT","Deutsche Welle","Germany","Overhauling public policy could be key to improving long-term health outcomes says Brazil investigation of eight national dietary surveys.","https://www.dw.com/en/brazilian-study-links-ultraprocessed-foods-to-early-death/a-72376669?maca=en-rss-en-all-1573-xml-mrss","en"
"Learning to live with earthquakes: Lessons from around the world","Mon, 28 Apr 2025 13:59:00 GMT","Deutsche Welle","Germany","Earthquakes are part of nature but they do not have to be disasters. DW looks at some countries that are showing how preparation, innovation, and determination can save lives.","https://www.dw.com/en/learning-to-live-with-earthquakes-lessons-from-around-the-world/a-72375835?maca=en-rss-en-all-1573-xml-mrss","en"
"Is driving becoming a luxury in Germany?","Mon, 28 Apr 2025 13:15:00 GMT","Deutsche Welle","Germany","For many young people in Germany, getting a driver's license has become almost unaffordable. Calls for reform are growing louder, but will it be enough?","https://www.dw.com/en/is-driving-becoming-a-luxury-in-germany/a-72272097?maca=en-rss-en-all-1573-xml-mrss","en"
"'Conclave': Pope's election turned into political thriller","Mon, 28 Apr 2025 08:36:00 GMT","Deutsche Welle","Germany","More than 100 cardinals will join a Vatican conclave to elect Pope Francis' successor. The subject of an Oscar-winning film and best-selling book, papal elections are now a pop-culture sensation.","https://www.dw.com/en/conclave-pope-s-election-turned-into-political-thriller/a-72354684?maca=en-rss-en-all-1573-xml-mrss","en"
"Car ramming attacks: Why do they keep happening?","Sun, 27 Apr 2025 10:36:00 GMT","Deutsche Welle","Germany","Cars are being used as weapons, to ram, kill and maim innocent people. The reasons why are not always clear, nor are solutions to preventing such attacks.","https://www.dw.com/en/car-ramming-attacks-why-do-they-keep-happening/a-71827106?maca=en-rss-en-all-1573-xml-mrss","en"
"Israel prepares ‘unprecedented’ attack after killing over 30 Palestinians at Gaza school","Mon, 26 May 2025 19:00:33 GMT","El País English","Spain","The Netanyahu government claimed to have struck 200 ‘terrorist’ targets in 48 hours, while humanitarian and diplomatic efforts continue to fail","https://english.elpais.com/international/2025-05-26/israel-prepares-another-unprecedented-attack-after-killing-30-palestinians-at-gaza-school.html","en"
"Calling Putin ‘crazy,’ Trump says he is open to new sanctions against Russia after latest attacks on Ukraine","Mon, 26 May 2025 12:26:39 GMT","El País English","Spain","The US president also had criticism for the Ukrainian leader Volodymyr Zelenskiy: ‘Everything out of his mouth causes problems’","https://english.elpais.com/international/2025-05-26/calling-putin-crazy-trump-says-he-is-open-to-new-sanctions-against-russia-after-latest-attacks-on-ukraine.html","en"
"Venezuela holds elections marked by low turnout and opposition repression","Mon, 26 May 2025 07:55:39 GMT","El País English","Spain","Chavismo allegedly won 82.6% of the vote and nearly all governorships, amid widespread abstention. María Corina Machado praised the population for ‘not heeding the regime’s call’","https://english.elpais.com/international/2025-05-26/venezuela-holds-elections-marked-by-low-turnout-and-opposition-repression.html","en"
"The 3.5% tax on remittances: A blow of over $2.7 billion for undocumented Mexican migrants","Mon, 26 May 2025 09:48:03 GMT","El País English","Spain","The Sheinbaum government says it will continue lobbying to stop the levy, which will affect four million Mexicans in the US","https://english.elpais.com/economy-and-business/2025-05-26/the-35-tax-on-remittances-a-blow-of-over-27-billion-for-undocumented-mexican-migrants.html","en"
"AI recreates the faces of enslaved people in Brazil based on descriptions by an abolitionist","Mon, 26 May 2025 11:15:49 GMT","El País English","Spain","An exhibition in São Paulo rescues the visual identity of dozens of people freed by self-taught lawyer Luiz Gama in the 19th century","https://english.elpais.com/international/2025-05-26/ai-recreates-the-faces-of-enslaved-people-in-brazil-based-on-descriptions-by-an-abolitionist.html","en"
"Should we wipe out the pests now that we can?","Mon, 26 May 2025 11:08:43 GMT","El País English","Spain","New tools bring closer the possibility of exterminating species considered harmful to humans, which is fueling an ethical dilemma","https://english.elpais.com/science-tech/2025-05-26/should-we-wipe-out-the-pests-now-that-we-can.html","en"
"On the front lines of Harvard’s resistance to Trump: ‘The first thing authoritarians do is attack universities’","Mon, 26 May 2025 10:16:28 GMT","El País English","Spain","The ban on admitting foreign students, suspended by a judge, foreshadows a long battle between the university and the government. The future of higher education in the US depends on its ability to withstand these attacks","https://english.elpais.com/usa/2025-05-26/on-the-front-lines-of-harvards-resistance-to-trump-the-first-thing-authoritarians-do-is-attack-universities.html","en"
"Farmworkers needed on visa program but they fear they’re in danger because of federal policies and politics","Mon, 26 May 2025 12:21:35 GMT","El País English","Spain","H-2A guest workers are guaranteed premium wages and free housing, but that could change.","https://english.elpais.com/usa/2025-05-26/farmworkers-needed-on-visa-program-but-they-fear-theyre-in-danger-because-of-federal-policies-and-politics.html","en"
"Overcrowding, attacks, and escapes: French prison system nears collapse","Mon, 26 May 2025 14:04:16 GMT","El País English","Spain","The government is considering building high-security prisons and establishing jails overseas as a solution to a saturated system that is failing to address rising crime","https://english.elpais.com/international/2025-05-26/overcrowding-attacks-and-escapes-french-prison-system-nears-collapse.html","en"
"Catherine Russell, UNICEF’s executive director: ‘Cuts in international aid will have an impact on children; there’s no way around it’","Sun, 25 May 2025 04:00:00 GMT","El País English","Spain","The head of the UN children’s agency warns of a critical moment, due to more global conflicts and fewer resources for humanitarian assistance","https://english.elpais.com/international/2025-05-25/catherine-russell-unicefs-executive-director-cuts-in-international-aid-will-have-an-impact-on-children-theres-no-way-around-it.html","en"
"The other side of Punta Cana: Haitian women raped to avoid deportation and children forced to leave school","Sun, 25 May 2025 04:00:00 GMT","El País English","Spain","The escalation of immigration measures against Haitians in the Dominican Republic is exacerbating the human rights crisis. The expulsion of refugees is also weakening vital sectors of the economy, such as tourism and construction","https://english.elpais.com/international/2025-05-25/the-other-side-of-punta-cana-haitian-women-raped-to-avoid-deportation-and-children-forced-to-leave-school.html","en"
"Spain, the only major European country to extradite people to China despite the ‘generalized violence’ in its prisons","Sun, 25 May 2025 04:00:00 GMT","El País English","Spain","No other major European state has deported anyone wanted by Beijing since the Court of Human Rights banned Poland from handing over a Taiwanese man in 2022 due to the risk of violating his fundamental rights","https://english.elpais.com/international/2025-05-25/spain-the-only-major-european-country-to-extradite-people-to-china-despite-the-generalized-violence-in-its-prisons.html","en"
"Janet Jackson’s 50 years in music, carrying the weight of her famous family name","Mon, 26 May 2025 12:26:47 GMT","El País English","Spain","The artist, with a long-lasting career that continues to evolve, will be honored for her trajectory and legacy with the Icon Award at the American Music Awards ceremony in Las Vegas, the city where she has extended her concert residency","https://english.elpais.com/culture/2025-05-26/janet-jacksons-50-years-in-music-carrying-the-weight-of-her-famous-family-name.html","en"
"Orwell was right: The dystopia of ‘1984’ is already here","Mon, 26 May 2025 12:18:58 GMT","El País English","Spain","In a new documentary presented at the Cannes Film Festival, director Raoul Peck uses the British writer’s thoughts to analyze a present marked by mass surveillance, the manipulation of language, and the advance of authoritarian governments","https://english.elpais.com/culture/2025-05-26/orwell-was-right-the-dystopia-of-1984-is-already-here.html","en"
"Slavoj Žižek, philosopher: ‘Wisdom is what I hate most, it is absolute conformist stupidity’","Sun, 25 May 2025 04:00:00 GMT","El País English","Spain","The Slovenian thinker, always controversial and politically incorrect, believes the good old days of liberal social democracy are over. In an exclusive interview, he says we are facing a new era in which it’s not possible to think of a better world, but merely of survival","https://english.elpais.com/culture/2025-05-25/slavoj-zizek-philosopher-wisdom-is-what-i-hate-most-it-is-absolute-conformist-stupidity.html","en"
"The artistic movement that anticipated the algorithm","Sun, 25 May 2025 04:00:00 GMT","El País English","Spain","An exhibition at London’s Tate Modern revisits the story of the pioneers who used science, technology, and innovation to create","https://english.elpais.com/culture/2025-05-25/the-artistic-movement-that-anticipated-the-algorithm.html","en"
"Life in Bogotá’s ‘pagadiarios’: Where $2 rent buys a night of shelter and little else","Sun, 25 May 2025 04:00:00 GMT","El País English","Spain","More than 14,000 people living in extreme poverty struggle to secure enough money to guarantee a roof over their heads","https://english.elpais.com/international/2025-05-25/life-in-bogotas-pagadiarios-where-2-rent-buys-a-night-of-shelter-and-little-else.html","en"
"Do we need publicly-owned social networks to escape Silicon Valley?","Sun, 25 May 2025 04:00:00 GMT","El País English","Spain","A state-run social media network could become an alternative to Twitter or Facebook, but it could also pose a risk to our privacy and freedom","https://english.elpais.com/opinion/2025-05-25/do-we-need-publicly-owned-social-networks-to-escape-silicon-valley.html","en"
"Lisa Randall, the theoretical physicist nominated for a Nobel Prize who wrote an opera about the fifth dimension","Sun, 25 May 2025 04:00:00 GMT","El País English","Spain","The professor at Harvard and researcher of other dimensions is one of the scientists who has raised her voice against Trump’s cuts","https://english.elpais.com/science-tech/2025-05-25/lisa-randall-the-theoretical-physicist-nominated-for-a-nobel-prize-who-wrote-an-opera-about-the-fifth-dimension.html","en"
"Hyperconnectivity and holographic calls: Telecoms race to meet growing demands","Sat, 24 May 2025 04:00:00 GMT","El País English","Spain","The business is reinventing itself amid regulatory pressure, decreased earnings and the rise of new technologies","https://english.elpais.com/technology/2025-05-24/hyperconnectivity-and-holographic-calls-telecoms-race-to-meet-growing-demands.html","en"
"Why tickling makes us laugh even when it annoys us and other mysteries that baffle neuroscience","Thu, 22 May 2025 14:58:46 GMT","El País English","Spain","A study explores key aspects of gargalesis, such as why certain areas of the body are more sensitive, why children tend to be more susceptible, and what its possible evolutionary function might be","https://english.elpais.com/science-tech/2025-05-22/why-tickling-makes-us-laugh-even-when-it-annoys-us-and-other-mysteries-that-baffle-neuroscience.html","en"
"Erectile dysfunction ‘can be a warning of a cardiovascular problem’","Fri, 23 May 2025 11:33:40 GMT","El País English","Spain","About half of male adults between the ages of 40 and 70 suffer from erection trouble, but there are effective treatments, such as Viagra or penile prostheses","https://english.elpais.com/health/2025-05-23/erectile-dysfunction-can-be-a-warning-of-a-cardiovascular-problem.html","en"
"Trump threatens the European Union with 50% tariffs starting June 1","Fri, 23 May 2025 13:25:10 GMT","El País English","Spain","The US president says negotiations with European countries are ‘going nowhere’","https://english.elpais.com/economy-and-business/2025-05-23/trump-threatens-the-european-union-with-50-tariffs-starting-june-1.html","en"
"David Lammy, UK Foreign Secretary: ‘The British have moved on from Brexit and they want a pragmatic government’","Tue, 20 May 2025 12:05:12 GMT","El País English","Spain","The champion of progressive realism says the first bilateral UK-EU summit in the post-Brexit era has begun to improve relations that had been ‘run into the ground’","https://english.elpais.com/international/2025-05-20/david-lammy-uk-foreign-secretary-the-british-have-moved-on-from-brexit-and-they-want-a-pragmatic-government.html","en"
"He Lifeng, the trusted aide to Xi Jinping who broke the trade deadlock","Mon, 19 May 2025 09:34:17 GMT","El País English","Spain","China’s vice premier has been leading negotiations with the US to ease trade tensions. What he lacks in charisma he makes up for in loyalty and discipline","https://english.elpais.com/economy-and-business/2025-05-19/he-lifeng-the-trusted-aide-to-xi-jinping-who-broke-the-trade-deadlock.html","en"
"The US, the country with which Mexico has co-produced the most films in the last year","Sun, 18 May 2025 04:00:00 GMT","El País English","Spain","For three decades, the Latin American nation has offered foreign productions a 0% tax rate","https://english.elpais.com/economy-and-business/2025-05-18/the-us-the-country-with-which-mexico-has-co-produced-the-most-films-in-the-last-year.html","en"
"Harvey Weinstein is ‘not that bad’ and Blake Lively is ‘not a good person‘: How the American right has turned the tables","Fri, 23 May 2025 13:45:17 GMT","El País English","Spain","While the producer, convicted of multiple crimes, is starting to be viewed favorably, the actress, who has sued a co-star for harassment, is portrayed as a villain","https://english.elpais.com/usa/2025-05-23/harvey-weinstein-is-not-that-bad-and-blake-lively-is-not-a-good-person-how-the-american-right-has-turned-the-tables.html","en"
"Spike Lee: ‘I don’t know how we can talk about American values considering who the president is’","Sun, 25 May 2025 04:00:00 GMT","El País English","Spain","The legendary director presented ‘Highest 2 Lowest’ at the Cannes Film Festival. Starring Denzel Washington, it’s a vibrant retelling of Akira Kurosawa’s classic ‘High and Low’","https://english.elpais.com/culture/2025-05-25/spike-lee-i-dont-know-how-we-can-talk-about-american-values-considering-who-the-president-is.html","en"
"The journey of Gaudí’s Batlló chair: Casa Valle’s redesign captivates US audiences","Sat, 24 May 2025 04:00:00 GMT","El País English","Spain","The NYCxDesign Festival showcased furniture designs by the greatest exponent of Catalan modernism","https://english.elpais.com/culture/2025-05-24/the-journey-of-gaudis-batllo-chair-casa-valles-redesign-captivates-us-audiences.html","en"
"‘Saturday Night Live’ looks back on the chaos of its live musical performances","Fri, 23 May 2025 14:45:19 GMT","El País English","Spain","Sets by the likes of Sinéad O’Connor, Elvis Costello, Rage Against the Machine, and Fear on the NBC show didn’t go as planned. That’s why they’re so memorable, as a new documentary recollects","https://english.elpais.com/culture/2025-05-23/saturday-night-live-looks-back-on-the-chaos-of-its-live-musical-performances.html","en"
"Why it’s better not to listen to Spotify playlists","Sat, 24 May 2025 04:00:00 GMT","El País English","Spain","Two recent books reveal the business practices that influence the content offered by this music platform","https://english.elpais.com/culture/2025-05-24/why-its-better-not-to-listen-to-spotify-playlists.html","en"
"Old versus new masculinities: The debate shaking up Cannes","Fri, 23 May 2025 15:30:51 GMT","El País English","Spain","Tom Cruise and Leonardo DiCaprio’s attitudes at the festival stand in contrast to those of Paul Mescal, Pedro Pascal, Alexander Skarsgård, Robert Pattinson, and Harris Dickinson","https://english.elpais.com/culture/2025-05-23/old-versus-new-masculinities-the-debate-shaking-up-cannes.html","en"
"Food Runners, the dating app alternative: Run, eat, meet someone new","Sun, 11 May 2025 04:11:00 GMT","El País English","Spain","Meeting up with strangers to run, then eat together afterward — that’s the new trend in France that blends exercise and food, and it’s already gaining traction in New York and London","https://english.elpais.com/lifestyle/2025-05-12/food-runners-the-dating-app-alternative-run-eat-meet-someone-new.html","en"
"Reflections on the Netflix series ‘Adolescence’: How to steer boys away from the manosphere","Sun, 18 May 2025 04:00:00 GMT","El País English","Spain","Discussing sexist stereotypes in advertising, films, and childhood stories — along with the example set by adults — are key tools in countering the influence of misogynistic content online","https://english.elpais.com/culture/2025-05-18/reflections-on-the-netflix-series-adolescence-how-to-steer-boys-away-from-the-manosphere.html","en"
"How emos survived their sadness: The ashes of an extinct urban tribe on the verge of resurrection","Sat, 03 May 2025 04:00:00 GMT","El País English","Spain","Bangs, heavy eyeliner, black skinny jeans, and melancholy — these were the trademarks of the emo subculture, which experienced a massive boom among teenagers in the 2000s. Now, it seems to have disappeared. But could it make a comeback with Generation Alpha?","https://english.elpais.com/culture/2025-05-03/how-emos-survived-their-sadness-the-ashes-of-an-extinct-urban-tribe-on-the-verge-of-resurrection.html","en"
"Welcome to the ‘antisocial century’: Are we lonelier now than ever?","Sat, 03 May 2025 04:00:00 GMT","El País English","Spain","New routines, such as eating alone in front of a phone, are a symptom of a growing epidemic of self-imposed isolation. Recent studies show they are causing unhappiness among more and more young people","https://english.elpais.com/lifestyle/2025-05-03/welcome-to-the-antisocial-century-are-we-lonelier-now-than-ever.html","en"
"Jeff Bezos’ bachelor party: Highlights from his Madrid stag night","Thu, 22 May 2025 16:07:58 GMT","El País English","Spain","Five renowned venues — including nightclubs, bars, and restaurants — were chosen by the Amazon founder for the celebration","https://english.elpais.com/people/2025-05-22/jeff-bezos-bachelor-party-highlights-from-his-madrid-stag-night.html","en"
"Meet MrBeast, the controversial YouTuber with millions of followers","Sat, 24 May 2025 04:00:00 GMT","El País English","Spain","The content creator has nearly 400 million subscribers on one of his channels — the highest number on the platform. His most recent controversy is with Mexico’s Ministry of Culture for having filmed inside a Mayan temple","https://english.elpais.com/people/2025-05-24/meet-mrbeast-the-controversial-youtuber-with-millions-of-followers.html","en"
"Rihanna’s baby bump steals the show again at Cannes: A look back at her maternity fashion statements","Thu, 22 May 2025 14:23:13 GMT","El País English","Spain","The Barbadian singer attended the French film festival with A$AP Rocky, showcasing her unique style during her third pregnancy","https://english.elpais.com/people/2025-05-22/rihannas-baby-bump-steals-the-show-again-at-cannes-a-look-back-at-her-maternity-fashion-statements.html","en"
"Lamine Yamal: ‘I listen to old-school rappers like 50 Cent, Eminem... and some flamenco’","Sat, 17 May 2025 04:00:00 GMT","El País English","Spain","The FC Barcelona player stars in the latest Beats ad campaign. In the clip, he becomes the owner of his own record label","https://english.elpais.com/sports/2025-05-17/lamine-yamal-i-listen-to-old-school-rappers-like-50-cent-eminem-and-some-flamenco.html","en"
"Ezra Klein, journalist and writer: ‘The Democrats were more loyal to Biden than to their own chances of winning’","Sat, 24 May 2025 04:00:00 GMT","El País English","Spain","In his book ‘Abundance,’ the ‘New York Times’ columnist calls on the US left to create a more prosperous society by supporting new technologies and reducing bureaucracy","https://english.elpais.com/usa/2025-05-24/ezra-klein-journalist-and-writer-the-democrats-were-more-loyal-to-biden-than-to-their-own-chances-of-winning.html","en"
"Miami turns its back on Marco Rubio, its prodigal son in Washington","Sat, 24 May 2025 04:00:00 GMT","El País English","Spain","The first Latino Secretary of State squanders his political capital in Florida over Trump’s immigration policy and the decision to end TPS for Venezuelans","https://english.elpais.com/usa/2025-05-24/miami-turns-its-back-on-marco-rubio-its-prodigal-son-in-washington.html","en"
"Nayib Bukele consolidates his authoritarian style in El Salvador","Mon, 19 May 2025 12:23:08 GMT","El País English","Spain","The president’s approval ratings remain high as he nears six years in power, but both his image and leadership have evolved significantly","https://english.elpais.com/international/2025-05-19/nayib-bukele-consolidates-his-authoritarian-style-in-el-salvador.html","en"
"Rodri: Soccer’s most anticipated return","Sun, 18 May 2025 04:00:00 GMT","El País English","Spain","In September 2024, a serious knee injury halted the career of Rodrigo Hernández, a key player for both the Spanish national team and Manchester City. One month later, he received the Ballon d’Or. Now, Rodri is back. We visited him in Manchester","https://english.elpais.com/eps/2025-05-18/rodri-soccers-most-anticipated-return.html","en"
"EL PAÍS offers free Spanish lessons with Gymglish","Mon, 15 Nov 2021 14:10:11 GMT","El País English","Spain","Readers who sign up will receive a 15-day free trial of the online classes, which are adapted to a student’s specific needs","https://english.elpais.com/economy-and-business/2021-11-15/el-pais-offers-free-spanish-lessons-with-gymglish.html","en"
"Pride, defiance and jubilation among Trump supporters at rally to mark his first 100 days in office","Wed, 30 Apr 2025 11:23:48 GMT","El País English","Spain","The US president derided migrants and joked about his opponents at an event outside Detroit that had all the ingredients of a campaign rally","https://english.elpais.com/usa/2025-04-30/pride-defiance-and-jubilation-among-trump-supporters-at-rally-to-mark-his-first-100-days-in-office.html","en"
"The US targets La Familia Michoacana in its crusade against fentanyl","Wed, 16 Apr 2025 10:23:21 GMT","El País English","Spain","On the same day, the Treasury Department sanctioned the two leaders of the criminal organization, a Georgia court indicted them, and the State Department offered $8 million for their capture","https://english.elpais.com/usa/2025-04-16/the-us-targets-la-familia-michoacana-in-its-crusade-against-fentanyl.html","en"
"Chancellor Merz’s international challenge: Make Germany ‘independent’ from the US or maintain the link despite Trump","Tue, 06 May 2025 14:31:13 GMT","El País English","Spain","The grieving process for the possible loss of Washington’s protective power has begun. ‘Our interest is to keep the Americans in Europe,’ says a prominent Christian Democrat","https://english.elpais.com/international/2025-05-06/chancellor-merzs-international-challenge-make-germany-independent-from-the-us-or-maintain-the-link-despite-trump.html","en"
"Israel deals yet another blow to Gaza’s decimated healthcare system","Tue, 15 Apr 2025 11:29:13 GMT","El País English","Spain","Nearly all hospitals have been damaged, with less than half partially operational. The latest to be bombed was Al Ahli, while medical supplies are running out due to Netanyahu’s decision to block their delivery","https://english.elpais.com/international/2025-04-15/israel-deals-yet-another-blow-to-gazas-decimated-healthcare-system.html","en"
"The Trump effect and the mistakes of Correismo hand Daniel Noboa victory in Ecuador","Tue, 15 Apr 2025 08:56:22 GMT","El País English","Spain","The conservative president won re-election in a run-off against the leftist Luisa González by almost 12 points, a margin that no poll had anticipated","https://english.elpais.com/international/2025-04-15/the-trump-effect-and-the-mistakes-of-correismo-hand-daniel-noboa-victory-in-ecuador.html","en"
