"title","publication_date","source","country","summary","url","language"
"Dial 911 anywhere: DILG eyes emergency call system nationwide","Mon, 26 May 2025 11:11:45 GMT","Philippine Daily Inquirer","Philippines","MANILA, Philippines — The Department of the Interior and Local Government (DILG) is aiming to roll out a unified 911 emergency call system in July. &#8220;We’ll get the SARO (special allotment release order) this week, so within around six to eight weeks, it’ll be finished,&#8221; DILG Secretary Jonvic Remulla said in a press briefing at","https://newsinfo.inquirer.net/2063565/dial-911-anywhere-dilg-eyes-emergency-call-system-nationwide","en"
"Marcos signs law increasing bed capacity in PGH","Mon, 26 May 2025 10:51:49 GMT","Philippine Daily Inquirer","Philippines","MANILA, Philippines — President Ferdinand Marcos Jr. has signed a law increasing the bed capacity at the Philippine General Hospital (PGH). Republic Act No. 12210, also known as An Act Increasing the Bed Capacity of the Philippine General Hospital From One Thousand Three Hundred Thirty-Four (1,334) to Two Thousand Two Hundred (2,200) Beds, and Appropriating Funds","https://newsinfo.inquirer.net/2063543/marcos-signs-law-increasing-bed-capacity-in-pgh","en"
"Free toll at Skyway Stage 3, odd-even scheme to be set during Edsa rehab","Mon, 26 May 2025 10:46:48 GMT","Philippine Daily Inquirer","Philippines","MANILA, Philippines — The Department of Transportation (DOTr) said a free toll for Skyway Stage 3 and an odd-even scheme will be enforced during the rebuilding of the Epifanio de los Santos Avenue (Edsa). Transportation Sec. Vince Dizon made the announcement on Monday as he admitted that the rehabilitation will cause heavy traffic, especially for","https://newsinfo.inquirer.net/2063540/free-toll-odd-even-scheme-to-be-enforced-during-edsa-rebuild-dotr","en"
"Over 21,500 cops to flood Metro Manila streets in visibility drive","Mon, 26 May 2025 10:20:48 GMT","Philippine Daily Inquirer","Philippines","MANILA, Philippines — The National Capital Region Police Office (NCRPO) has deployed over 21,500 personnel to patrol busy and packed streets across Metro Manila as part of its visibility operations. Interior Secretary Jonvic Remulla and NCRPO Director Maj. Gen. Anthony Aberin oversaw the launch of the police visibility program at Camp Bagong Diwa in Taguig","https://newsinfo.inquirer.net/2063535/over-21500-cops-to-flood-metro-manila-streets-in-visibility-drive","en"
"DILG’s Remulla yet to hear from Marcos on his courtesy resignation","Mon, 26 May 2025 09:22:45 GMT","Philippine Daily Inquirer","Philippines","MANILA, Philippines — Interior Secretary Jonvic Remulla said Monday he has yet to learn whether President Ferdinand Marcos Jr. will accept his courtesy resignation. He made the remark during a chance interview with reporters while inspecting a police station in Quezon City on Monday. &#8220;I don’t know whether I’ll still have a job later. It’s","https://newsinfo.inquirer.net/2063527/dilgs-remulla-yet-to-hear-from-marcos-on-his-courtesy-resignation","en"
"Marcos already has his pick for next PNP chief – Remulla","Mon, 26 May 2025 09:18:50 GMT","Philippine Daily Inquirer","Philippines","MANILA, Philippines — President Ferdinand Marcos Jr. has already chosen the next Philippine National Police (PNP) chief, according to Interior Secretary Jonvic Remulla. Current PNP Chief Gen. Rommel Marbil’s term is set to expire on June 7. “Nag-usap na kami. May napupusuan na siya. Pero, hintayin na lang natin yung announcement niya,” Remulla said of","https://newsinfo.inquirer.net/2063525/marcos-already-has-his-pick-for-next-pnp-chief-remulla","en"
"Metro Manila among 25 areas to hit ‘danger’ heat index on May 26","Mon, 26 May 2025 07:35:45 GMT","Philippine Daily Inquirer","Philippines","MANILA, Philippines — The state weather bureau said 25 areas, including Metro Manila, are expected to reach “danger” level peak heat indices on Monday, May 26. Heat index measures how high humidity combined with unusually high temperatures reduces the body’s ability to cool itself, according to the Philippine Atmospheric, Geophysical, and Astronomical Services Administration (Pagasa). READ:","https://newsinfo.inquirer.net/2063521/metro-manila-among-25-areas-to-hit-danger-heat-index-on-may-26","en"
"PCSO: No jackpot winners in latest Lotto draws","Mon, 26 May 2025 07:10:47 GMT","Philippine Daily Inquirer","Philippines","MANILA, Philippines — The Philippine Charity Sweepstakes Office (PCSO) said no winners were declared in the latest major lotto draws. READ: Lotto Results &#8211; May 25, 2025 | Inquirer.net In the evening draw on May 25, no one won the Ultra Lotto 6/58 jackpot, which stood at P76,870,794.40. The winning combination was 57-51-13-47-24-18. Meanwhile, no bettor","https://newsinfo.inquirer.net/2063516/pcso-no-jackpot-winners-in-latest-lotto-draws","en"
"ITCZ to bring rain to parts of PH on May 26","Mon, 26 May 2025 06:51:06 GMT","Philippine Daily Inquirer","Philippines","MANILA, Philippines — The intertropical convergence zone (ITCZ) is expected to continue bringing rain to parts of the country on Monday, May 26, the state weather bureau said. According to the Philippine Atmospheric, Geophysical, and Astronomical Services Administration (Pagasa), the ITCZ will affect parts of Palawan, Western Visayas, Negros Island Region, and the western portions","https://newsinfo.inquirer.net/2063511/itcz-to-bring-rain-to-parts-of-ph-on-may-26","en"
"MMDA vows fairness in ‘No-contact’ policy","Mon, 26 May 2025 05:50:04 GMT","Philippine Daily Inquirer","Philippines","MANILA, Philippines — The Metropolitan Manila Development Authority (MMDA) will again enforce, starting today, May 26, the No Contact Apprehension Policy (NCAP) on major thoroughfares in the National Capital Region, with the agency assuring motorists of fairness in citing traffic violations. The agency also clarified that the policy will not yet be enforced in some","https://newsinfo.inquirer.net/2063477/mmda-vows-fairness-in-no-contact-policy","en"
"285 lawmakers back Romualdez as House speaker","Mon, 26 May 2025 05:35:05 GMT","Philippine Daily Inquirer","Philippines","MANILA, Philippines — A total of 285 incoming representatives, including four of the six Liberal Party (LP) members, in the 20th Congress will be backing the continuity of Speaker Martin Romualdez’s leadership at the House of Representatives, Deputy Speaker David Suarez said on Sunday. Suarez, who was reelected as Quezon&#8217;s second district representative, said in","https://newsinfo.inquirer.net/2063481/285-lawmakers-back-romualdez-as-house-speaker","en"
"Think tank urges senators to rise above politics in VP trial","Mon, 26 May 2025 05:30:09 GMT","Philippine Daily Inquirer","Philippines","MANILA, Philippines — As the Senate prepares to start impeachment proceedings against Vice President Sara Duterte, international think tank Stratbase Institute on Sunday challenged the senators “to rise above political alliances and personal interests.” Stratbase president Dindo Manhit stressed that the upcoming impeachment trial will serve as a challenge for incumbent, returning, and newly elected","https://newsinfo.inquirer.net/2063484/think-tank-urges-senators-to-rise-above-politics-in-vp-trial","en"
"CA to still hold hearings on 3 Cabinet members","Mon, 26 May 2025 05:25:54 GMT","Philippine Daily Inquirer","Philippines","MANILA, Philippines — The Commission on Appointments (CA) confirmation hearings for three members of the Cabinet would continue despite their submission of their courtesy resignations to President Marcos. Surigao del Sur Rep. Johnny Pimentel, CA assistant minority leader, said that the CA scrutiny of the ad interim appointments of Transportation Secretary Vince Dizon; Information and","https://newsinfo.inquirer.net/2063486/ca-to-still-hold-hearings-on-3-cabinet-members","en"
"Rufus Rodriguez riled by US travel advisory","Mon, 26 May 2025 05:15:19 GMT","Philippine Daily Inquirer","Philippines","MANILA, Philippines —A Mindanao lawmaker on Sunday called on the Department of Foreign Affairs (DFA) to summon the United States envoy to Manila to explain a travel advisory that warned Americans visiting the Philippines of supposedly increased risk to their safety. Reelected Cagayan de Oro Rep. Rufus Rodriguez also urged President Marcos to ask the","https://newsinfo.inquirer.net/2063491/rufus-rodriguez-riled-by-us-travel-advisory","en"
"Ex-Legazpi bishop Cariño dies at 86","Mon, 26 May 2025 05:05:06 GMT","Philippine Daily Inquirer","Philippines","MANILA, Philippines — Retired Bishop Nestor Cariño, who served in at least three dioceses and was a former secretary general of the Catholic Bishops’ Conference of the Philippines (CBCP), died on Saturday. He was 86. The Diocese of Legazpi, where he served as its bishop emeritus, confirmed his death in a statement, saying Cariño passed","https://newsinfo.inquirer.net/2063489/ex-legazpi-bishop-carino-dies-at-86","en"
"Jinggoy Estrada’s son assaulted in Boracay","Mon, 26 May 2025 04:45:12 GMT","Philippine Daily Inquirer","Philippines","MANILA, Philippines — Senate President Pro Tempore Jinggoy Estrada confirmed on Sunday that his son, Julian and his cousin, Jefferelly Vitug, were attacked by three individuals while vacationing at the resort island. The senator said the attackers have already been arrested but were not identified. READ: ‘Smart’ port system coming to Boracay in April Charges","https://newsinfo.inquirer.net/2063475/jinggoy-estradas-son-assaulted-in-boracay","en"
"Flooded Mindanao areas need help","Mon, 26 May 2025 04:40:20 GMT","Philippine Daily Inquirer","Philippines","COTABATO CITY, BARMM, Philippines — The Climate Conflict Action Asia (CCAA), a group monitoring conflict in Mindanao, warned of a “full-blown humanitarian crisis” in flood-hit areas in the Bangsamoro, particularly the Maguindanao provinces, if no actions were immediately taken. The CCAA said heavy rains in the past days that had submerged low-lying areas in Maguindanao","https://newsinfo.inquirer.net/2063466/flooded-mindanao-areas-need-help","en"
"Cross-border gambling operation busted in Laos, 31 charged","Mon, 26 May 2025 18:48:20 GMT","VnExpress International","Vietnam","A joint operation of Vietnamese and Lao police have dismantled a major cross-border online gambling ring that enabled thousands of people to place illegal bets worth nearly VND1.3 trillion (US$50 million), Vietnam's Ministry of Public Security said.","https://e.vnexpress.net/news/news/crime/cross-border-gambling-operation-busted-in-laos-31-charged-4890681.html","en"
"Hanoi shivers as rare cold snap chills northern Vietnam in summer","Mon, 26 May 2025 15:57:04 GMT","VnExpress International","Vietnam","Hanoi residents woke up to an unexpected chill on Sunday as temperatures dipped to 20 degrees, unusual for late May, but not unprecedented, according to weather experts.","https://e.vnexpress.net/news/news/environment/hanoi-shivers-as-rare-cold-snap-chills-northern-vietnam-in-summer-4890687.html","en"
"Vietnam hosts welcome ceremony for French President Macron in Hanoi","Mon, 26 May 2025 14:35:59 GMT","VnExpress International","Vietnam","State President Luong Cuong and his spouse hosted a welcome ceremony in Hanoi on Monday for French President Emmanuel Macron and his spouse, who are on a state visit to Vietnam from May 25-27.","https://e.vnexpress.net/news/news/politics/vietnam-hosts-welcome-ceremony-for-french-president-macron-in-hanoi-4890629.html","en"
"Tourist killed as off-road vehicle plunges into lake near Phan Thiet","Mon, 26 May 2025 10:30:30 GMT","VnExpress International","Vietnam","One woman died after an off-road vehicle carrying eight tourists plunged down a sand dune into Bau Trang Lake near the central beach city of Phan Thiet.","https://e.vnexpress.net/news/news/tourist-killed-as-off-road-vehicle-plunges-into-lake-near-phan-thiet-4890511.html","en"
"Man detained for vandalizing throne of Vietnam's last royal family","Mon, 26 May 2025 10:25:13 GMT","VnExpress International","Vietnam","Vietnamese police have detained a man who broke into a history exhibit and damaged an antique throne considered to be one of the nation's most precious artifacts, conservation officials said on Sunday.","https://e.vnexpress.net/news/news/man-detained-for-vandalizing-throne-of-vietnam-s-last-royal-family-4890489.html","en"
"French President Macron and First Lady take nighttime stroll around Hanoi's Hoan Kiem Lake","Mon, 26 May 2025 09:33:56 GMT","VnExpress International","Vietnam","French President Emmanuel Macron and his wife Brigitte Macron took a nighttime walk around Hoan Kiem Lake and visited Ngoc Son Temple shortly after arriving in Hanoi on Sunday.","https://e.vnexpress.net/photo/politics/french-president-macron-and-first-lady-take-nighttime-stroll-around-hanois-hoan-kiem-lake-4890460.html","en"
"Vietnam airport wins architecture award for terminal design","Mon, 26 May 2025 07:29:12 GMT","VnExpress International","Vietnam","The T2 international terminal at Phu Bai International Airport in Hue has clinched the gold award in special architecture at the 2024-2025 National Architecture Award, highlighting blend of heritage and modern design.","https://e.vnexpress.net/news/news/traffic/vietnam-airport-wins-architecture-award-for-terminal-design-4889278.html","en"
"Nguyen Dynasty throne vandalized at Hue's Imperial City","Sun, 25 May 2025 15:18:50 GMT","VnExpress International","Vietnam","A man vandalized the Nguyen Dynasty throne inside Thai Hoa Palace, part of the Hue Imperial City, shattering parts of the historic national treasure.","https://e.vnexpress.net/news/news/nguyen-dynasty-throne-vandalized-at-hue-s-imperial-city-4890277.html","en"
"Foreign leaders pay tribute to former State President Tran Duc Luong in Hanoi","Sun, 25 May 2025 10:30:31 GMT","VnExpress International","Vietnam","International delegations have come to the National Funeral Hall at No. 5 Tran Thanh Tong Street in Hanoi to pay their respects to former State President Tran Duc Luong, who passed away on May 20.","https://e.vnexpress.net/news/news/foreign-leaders-pay-tribute-to-former-state-president-tran-duc-luong-in-hanoi-4890229.html","en"
"Memorial service held for former State President Tran Duc Luong","Sun, 25 May 2025 10:22:57 GMT","VnExpress International","Vietnam","A memorial service was held for Tran Duc Luong, former Politburo member and former State President, in the national mourning etiquette at the National Funeral Hall, No. 5 Tran Thanh Tong street in Hanoi, on Sunday morning.","https://e.vnexpress.net/news/news/memorial-service-held-for-former-state-president-tran-duc-luong-4890227.html","en"
"Thousands remain isolated as floods ease in eastern Australia","Sat, 24 May 2025 20:07:59 GMT","VnExpress International","Vietnam","Tens of thousands of Australians remained isolated and thousands were without power on Saturday, authorities said as conditions in New South Wales eased after days of heavy rain that caused widespread flooding.","https://e.vnexpress.net/news/news/environment/thousands-remain-isolated-as-floods-ease-in-eastern-australia-4890117.html","en"
"Man's journey from scrap-collecting to Asia's most prestigious university and state advisor at age 26","Sat, 24 May 2025 19:00:00 GMT","VnExpress International","Vietnam","A young man who became nationally famous seven years ago for overcoming severe hardships to gain admission to Tsinghua University, China's top institution and Asia's most prestigious, has been appointed an advisor to the Hebei provincial government at the age of 26.","https://e.vnexpress.net/news/news/education/man-s-journey-from-scrap-collecting-to-asia-s-most-prestigious-university-and-state-advisor-at-age-26-4889653.html","en"
"Sun-fearing woman breaks rib in bed due to extreme vitamin D deficiency","Sat, 24 May 2025 13:28:44 GMT","VnExpress International","Vietnam","A 48-year-old woman from China's southwestern Sichuan Province fractured a rib simply by turning over in bed, due to severe vitamin D deficiency caused by excessive sun avoidance.","https://e.vnexpress.net/news/news/sun-fearing-woman-breaks-rib-in-bed-due-to-extreme-vitamin-d-deficiency-4890033.html","en"
"Vietnam coordinates with Japan to investigate suspected Vietnamese theft-ring leaders","Sat, 24 May 2025 13:28:31 GMT","VnExpress International","Vietnam","Vietnam's representative agencies in Japan are cooperating with Japanese authorities following Tokyo's issuance of arrest warrants for two Vietnamese citizens suspected of directing a shoplifting ring in Japan.","https://e.vnexpress.net/news/news/crime/vietnam-coordinates-with-japan-to-investigate-suspected-vietnamese-theft-ring-leaders-4889993.html","en"
"Chinese students cancel flights, fear ICE raids as Trump bans Harvard enrollment","Sat, 24 May 2025 13:28:02 GMT","VnExpress International","Vietnam","Chinese students at Harvard scrambled to cancel flights and seek legal advice on Friday after the Trump administration abruptly barred the university from enrolling foreign students, throwing their futures into uncertainty.","https://e.vnexpress.net/news/news/education/chinese-students-cancel-flights-fear-ice-raids-as-trump-bans-harvard-enrollment-4890051.html","en"
"From selling vegetables in rural Vietnam to PhD scholarship in US: Woman defies odds","Sat, 24 May 2025 13:00:00 GMT","VnExpress International","Vietnam","Determined to escape poverty, a woman who once sold vegetables to support her family worked hard to get into university abroad and is all set to do a PhD.","https://e.vnexpress.net/news/news/education/from-selling-vegetables-in-rural-vietnam-to-phd-scholarship-in-us-woman-defies-odds-4884689.html","en"
"State funeral held for former State President Tran Duc Luong","Sat, 24 May 2025 11:37:43 GMT","VnExpress International","Vietnam","A State funeral for former Politburo member and former State President Tran Duc Luong was held at the National Funeral Hall in Hanoi on Saturday morning with the national mourning etiquette.","https://e.vnexpress.net/news/news/politics/state-funeral-held-for-former-state-president-tran-duc-luong-4886277.html","en"
"Captive Asian black bear transferred to rescue center in central Vietnam","Sat, 24 May 2025 11:09:35 GMT","VnExpress International","Vietnam","A man in the central province of Nghe An has handed over an Asian black bear (Ursus thibetanus) to the Vietnam Bear Rescue Center at Bach Ma National Park in Hue City.","https://e.vnexpress.net/news/news/environment/captive-asian-black-bear-transferred-to-rescue-center-in-central-vietnam-4889968.html","en"
"Power outage halts Hanoi metro line for nearly an hour","Sat, 24 May 2025 09:21:36 GMT","VnExpress International","Vietnam","A power outage temporarily suspended operations on Hanoi's Nhon – Hanoi Station metro line for nearly an hour on Friday afternoon, affecting four stations.","https://e.vnexpress.net/news/news/traffic/power-outage-halts-hanoi-metro-line-for-nearly-an-hour-4889962.html","en"
"HCMC airport new terminal floor to be completed only by June end","Sat, 24 May 2025 09:00:00 GMT","VnExpress International","Vietnam","The flooring is still incomplete in several places in Tan Son Nhat airport's T3 domestic terminal a month after its opening, and is only expected to be finished by June end.","https://e.vnexpress.net/news/news/traffic/hcmc-airport-new-terminal-floor-to-be-completed-only-by-june-end-4889731.html","en"
"Leaking roof floods Hanoi metro station after heavy rain","Sat, 24 May 2025 08:28:47 GMT","VnExpress International","Vietnam","Around 50 square meters of roofing at Yen Nghia Station on Hanoi’s Cat Linh – Ha Dong metro line were damaged, causing rainwater to flood onto the platform on Friday.","https://e.vnexpress.net/news/news/traffic/leaking-roof-floods-hanoi-metro-station-after-heavy-rain-4889940.html","en"
"Thailand arrests 3 for running fake Pattaya hotel pages to scam $21,300 from tourists","Sat, 24 May 2025 06:00:00 GMT","VnExpress International","Vietnam","Thai police have arrested three suspects for allegedly scamming international tourists out of more than US$21,300 through fake Facebook pages posing as popular Pattaya hotels.","https://e.vnexpress.net/news/news/crime/thailand-arrests-3-for-running-fake-pattaya-hotel-pages-to-scam-21-300-from-tourists-4889425.html","en"
"Vietnam busts Taiwan medicinal fungus multi-level marketing scam with 9,000 members","Sat, 24 May 2025 06:00:00 GMT","VnExpress International","Vietnam","Vietnamese authorities have busted an international multi-level marketing network with 9,000 people selling so-called medicinal fungus, with its transactions totaling trillions of dong.","https://e.vnexpress.net/news/news/crime/vietnam-busts-taiwan-medicinal-fungus-multi-level-marketing-scam-with-9-000-members-4889357.html","en"
"Judge temporarily halts Trump block on foreign students at Harvard","Sat, 24 May 2025 05:52:47 GMT","VnExpress International","Vietnam","A judge suspended Friday the Trump administration's move to block Harvard from enrolling and hosting foreign students after the prestigious university sued, calling the action unconstitutional.","https://e.vnexpress.net/news/news/education/judge-temporarily-halts-trump-block-on-foreign-students-at-harvard-4885561.html","en"
"Shock and anger as Harvard students react to Trump's foreign enrollment ban","Sat, 24 May 2025 05:34:19 GMT","VnExpress International","Vietnam","Harvard's international student community is reeling after the Trump administration abruptly revoked the university's ability to enroll foreign students, triggering panic and uncertainty across the Cambridge campus.","https://e.vnexpress.net/news/news/education/shock-and-anger-as-harvard-students-react-to-trump-s-foreign-enrollment-ban-4889864.html","en"
"Vietnamese students in panic as Trump bans Harvard from enrolling foreigners","Sat, 24 May 2025 05:34:04 GMT","VnExpress International","Vietnam","Vietnamese students at Harvard University are reeling after the Trump administration abruptly stripped the school of its ability to admit international students, leaving the futures of thousands, including about 20 Vietnamese scholars, hanging in the balance.","https://e.vnexpress.net/news/news/education/vietnamese-students-in-panic-as-trump-bans-harvard-from-enrolling-foreigners-4889775.html","en"
"How the Trump administration's move will affect Harvard's international students","Fri, 23 May 2025 14:53:53 GMT","VnExpress International","Vietnam","President Donald Trump's administration escalated its standoff with Harvard University on Thursday, revoking the school's ability to enroll international students.","https://e.vnexpress.net/news/news/education/how-the-trump-administration-s-move-will-affect-harvard-s-international-students-4889718.html","en"
"Thailand reports 50,000 Covid-19 cases in one week as new variant drives surge","Fri, 23 May 2025 14:32:48 GMT","VnExpress International","Vietnam","Thailand has recorded over 50,000 new Covid-19 cases in just one week, with health officials warning that the surge, driven by the fast-spreading Omicron XEC variant, has yet to peak.","https://e.vnexpress.net/news/news/thailand-reports-50-000-covid-19-cases-in-one-week-as-new-variant-drives-surge-4889429.html","en"
"Prime Minister to pay official visit to Malaysia, attend 46th ASEAN Summit","Fri, 23 May 2025 21:52:33 GMT","VnExpress International","Vietnam","Prime Minister Pham Minh Chinh, his spouse, and a high-ranking delegation of Vietnam will pay an official visit to Malaysia and attend the 46th ASEAN Summit and related events there from May 24-28.","https://e.vnexpress.net/news/news/prime-minister-to-pay-official-visit-to-malaysia-attend-46th-asean-summit-4889867.html","en"
"4 dead, 17 trapped in landslides in China","Fri, 23 May 2025 15:06:47 GMT","VnExpress International","Vietnam","Landslides in a rural area in China's southwestern Guizhou Province have killed at least four people with 17 others still missing in the debris, state media said.","https://e.vnexpress.net/news/news/environment/4-dead-17-trapped-in-landslides-in-china-4889743.html","en"
"2 truck drivers in Hanoi jailed for crash that killed woman, 3 children","Fri, 23 May 2025 09:10:10 GMT","VnExpress International","Vietnam","Two truck drivers, one of them driving under the influence of drugs, have been sentenced to prison for causing an accident that killed a woman and her three children in Hanoi last year.","https://e.vnexpress.net/news/news/traffic/2-truck-drivers-in-hanoi-jailed-for-crash-that-killed-woman-3-children-4889324.html","en"
"Several dead in plane crash on California neighborhood","Fri, 23 May 2025 08:05:29 GMT","VnExpress International","Vietnam","Several people were killed when a small plane crashed in a California neighborhood before dawn Thursday, destroying a home and setting more than a dozen cars on fire.","https://e.vnexpress.net/news/news/traffic/several-dead-in-plane-crash-on-california-neighborhood-4889469.html","en"
"Thailand vows to tighten control on cannabis after smuggling cases involving tourists soar","Fri, 23 May 2025 07:29:43 GMT","VnExpress International","Vietnam","Thai officials said they planned to tighten regulations on cannabis sales after cases of tourists attempting to smuggle the drug out of the country soared in recent months.","https://e.vnexpress.net/news/news/crime/thailand-vows-to-tighten-control-on-cannabis-after-smuggling-cases-involving-tourists-soar-4889129.html","en"
