"title","publication_date","source","country","summary","url","language"
"Feminist Forum urges M.A. Baby to withdraw remark supporting Dileep film","Mon, 26 May 2025 20:47:07 GMT","The Hindu National","India","Feminist Forum urges M.","https://www.thehindu.com/news/national/kerala/feminist-forum-urges-ma-baby-to-withdraw-remark-supporting-dileep-film/article69621472.ece","en"
"Service roads between Hebbal and Silk Board to be merged with ORR till metro construction is over","Mon, 26 May 2025 20:44:07 GMT","The Hindu National","India","The decision comes in the wake of metro construction occupying significant portions of road space and disrupting vehicular movement","https://www.thehindu.com/news/cities/bangalore/service-roads-between-hebbal-and-silk-board-to-be-merged-with-orr-till-metro-construction-is-over/article69621514.ece","en"
"YouTubers complain after newswire agency ANI demands licence fee","Mon, 26 May 2025 20:44:05 GMT","The Hindu National","India","ANI has sent emails demanding a licence fee from YouTubers using clips published by them, prompting protests from channels; move violates creative expression, says content creator Mohak Mangal","https://www.thehindu.com/news/national/youtubers-complain-after-newswire-agency-demands-licence-fee/article69621305.ece","en"
"Health awareness programme in Kalaburagi on Wednesday","Mon, 26 May 2025 20:42:21 GMT","The Hindu National","India","Health awareness programme in Kalaburagi on Wednesday https://www.","https://www.thehindu.com/news/national/karnataka/health-awareness-programme-in-kalaburagi-on-wednesday/article69621692.ece","en"
"KTR terms ‘Abhaya Hastham’ by Congress as century’s biggest betrayal","Mon, 26 May 2025 20:40:44 GMT","The Hindu National","India","He says the ruling party is fearing to hold any election with growing discontent among people","https://www.thehindu.com/news/national/telangana/ktr-terms-abhaya-hastham-by-congress-as-centurys-biggest-betrayal/article69621776.ece","en"
"As PM completes 11 years in office, Congress says promise of ‘achche din‘ turned into ‘nightmare’","Mon, 26 May 2025 20:39:27 GMT","The Hindu National","India","Congress chief Mallikarjun Kharge claimed inflation was at its peak, there was a flood of unemployment, consumption was at a ‘standstill’, ‘Make in India’ had ‘flopped’, and ‘inequality is also at its peak’","https://www.thehindu.com/news/national/as-pm-completes-11-years-in-office-congress-says-promise-of-achche-din-turned-into-nightmare/article69621556.ece","en"
"‘Basavanna’s Vachanas relevant as we’re still experiencing 12th Century social evils’","Mon, 26 May 2025 20:36:58 GMT","The Hindu National","India","Lokayukta releases ‘My Me Is Thee’, a book on Basavanna’s Vachanas translated into English","https://www.thehindu.com/news/national/karnataka/basavannas-vachanas-relevant-as-were-still-experiencing-12th-century-social-evils/article69621996.ece","en"
"HSS teacher transfer: final list published","Mon, 26 May 2025 20:36:03 GMT","The Hindu National","India","HSS teacher transfer: final list published https://www.","https://www.thehindu.com/news/national/kerala/hss-teacher-transfer-final-list-published/article69621885.ece","en"
"Lokayukta police find medicine stock without proper records at McGann Hospital in Shivamogga","Mon, 26 May 2025 20:33:57 GMT","The Hindu National","India","Lokayukta police find medicine stock without proper records at McGann Hospital in Shivamogga https://www.","https://www.thehindu.com/news/national/karnataka/lokayukta-police-find-medicine-stock-without-proper-records-at-mcgann-hospital-in-shivamogga/article69621868.ece","en"
"UDF announces Aryadan Shoukath as Nilambur bypoll candidate","Mon, 26 May 2025 20:32:24 GMT","The Hindu National","India","Congress national leadership announces Shoukath’s name and says it is a unanimous decision. Shoukath says he will address the stagnation of development that Nilambur faced in the past nine years","https://www.thehindu.com/news/national/kerala/udf-announces-aryadan-shoukath-as-nilambur-bypoll-candidate/article69621847.ece","en"
"Capsized cargo containers may drift towards Alappuzha, Kollam and Thiruvananthapuram in Kerala","Mon, 26 May 2025 20:31:07 GMT","The Hindu National","India","Capsized cargo containers may drift towards Alappuzha, Kollam and Thiruvananthapuram in Kerala https://www.","https://www.thehindu.com/news/national/telangana/capsized-cargo-containers-may-drift-towards-alappuzha-kollam-and-thiruvananthapuram-in-kerala/article69621938.ece","en"
"Srisailam to host YogAndhra event on May 31","Mon, 26 May 2025 20:28:13 GMT","The Hindu National","India","Srisailam to host YogAndhra event on May 31 https://www.","https://www.thehindu.com/news/national/andhra-pradesh/srisailam-to-host-yogandhra-event-on-may-31/article69621783.ece","en"
"CM reviews arrangements ahead of school reopening","Mon, 26 May 2025 20:27:45 GMT","The Hindu National","India","CM reviews arrangements ahead of school reopening https://www.","https://www.thehindu.com/news/national/kerala/cm-reviews-arrangements-ahead-of-school-reopening/article69621744.ece","en"
"Two men held for sexually abusing cousins","Mon, 26 May 2025 20:27:21 GMT","The Hindu National","India","Two men held for sexually abusing cousins https://www.","https://www.thehindu.com/news/national/telangana/two-men-held-for-sexually-abusing-cousins/article69621987.ece","en"
"Orange weather alert issued for Coimbatore and the Nilgiris districts from May 27","Mon, 26 May 2025 20:25:40 GMT","The Hindu National","India","Heavy rain has also been predicted at isolated places in Tiruppur, Dindigul, Virudhunagar, Erode, Krishnagiri, and Dharmapuri districts over the next two days","https://www.thehindu.com/news/national/tamil-nadu/southwest-monsoon-in-tamil-nadu-orange-alert-for-coimbatore-nilgiris-districts-from-may-27-2025/article69621805.ece","en"
"Israel-backed Gaza food aid plan dogged by delay and dissent","Tue, 27 May 2025 04:12:27 GMT","The Straits Times","Singapore","There was no indication that hand-outs were under way at the distribution station.","https://www.straitstimes.com/world/middle-east/israel-backed-gaza-food-aid-plan-dogged-by-delay-and-dissent","en"
"Trump attacks ‘scum’ opponents, judges on day honouring US fallen soldiers","Tue, 27 May 2025 03:30:42 GMT","The Straits Times","Singapore","“Now look what I have: I have everything,” Mr Trump said. “Amazing the way things work out.""","https://www.straitstimes.com/world/united-states/trump-attacks-scum-opponents-judges-on-day-honouring-us-fallen-soldiers","en"
"EU countries set to express concern about Hungary legislation targeting LGBTQ+ people, draft shows","Tue, 27 May 2025 02:38:41 GMT","The Straits Times","Singapore","BRUSSELS - More than a dozen European countries are expected to issue a declaration saying they are \""deeply concerned\"" about Hungarian legislation targeting LGBTQ+ people, according to a draft seen by Reuters on Monday.","https://www.straitstimes.com/world/europe/eu-countries-set-to-express-concern-about-hungary-legislation-targeting-lgbtq-people-draft-shows","en"
"Ukraine hit by record drone salvo after Trump rebukes Putin","Tue, 27 May 2025 01:55:05 GMT","The Straits Times","Singapore","For three nights in a row Russia has struck Ukraine with large-scale drone attacks, killing at least 13 people.","https://www.straitstimes.com/world/europe/ukraine-says-hit-by-record-drone-salvo-after-trump-rebukes-putin","en"
"EU sees ‘new impetus’ in US trade talks, businesses worry over uncertainty","Tue, 27 May 2025 01:20:51 GMT","The Straits Times","Singapore","The pan-European stocks index recovered to where it was trading before May 23’s surprise tariff announcement.","https://www.straitstimes.com/world/europe/update-1-eu-sees-new-impetus-in-us-trade-talks-businesses-worry-over-uncertainty","en"
"Kremlin says West lifting range limits on Ukraine arms would be ‘dangerous’","Tue, 27 May 2025 00:38:51 GMT","The Straits Times","Singapore","Kremlin spokesman Dmitry Peskov says giving Ukraine long-range missiles can jeopardise a peace settlement.","https://www.straitstimes.com/world/europe/kremlin-says-west-lifting-range-limits-on-ukraine-arms-quite-dangerous","en"
"Germany’s Chancellor Merz gives green light for Ukraine to strike deep inside Russia","Tue, 27 May 2025 00:22:29 GMT","The Straits Times","Singapore","Ukraine’s Western allies are intensifying pressure on Russia after it launched its biggest drone barrage on Ukraine.","https://www.straitstimes.com/world/europe/germanys-merz-gives-green-light-for-ukraine-to-strike-deep-inside-russia","en"
"Invasive species cost society over $2.8 trillion in damages, study shows","Mon, 26 May 2025 23:59:33 GMT","The Straits Times","Singapore","The accelerating spread of invasive species from mosquitoes to plants is driving extinction of other species.","https://www.straitstimes.com/world/europe/invasive-species-cost-society-2-8-trillion-in-damages-study-shows","en"
"NATO’s Rutte says he assumes alliance will agree on 5% spending target","Mon, 26 May 2025 23:48:36 GMT","The Straits Times","Singapore","BRUSSELS - NATO Secretary General Mark Rutte said on Monday that he assumes alliance members will agree to a broad defence spending target of 5% of gross domestic product during a summit in The Hague next month.","https://www.straitstimes.com/world/europe/nato%25E2%2580%2599s-rutte-says-he-assumes-alliance-will-agree-on-5-spending-target","en"
"‘Hand of Kremlin?’: Russian foreign ministry mocks Macron video","Mon, 26 May 2025 22:50:00 GMT","The Straits Times","Singapore","Mr Macron denied any “domestic dispute” with his wife.","https://www.straitstimes.com/world/hand-of-kremlin-russian-foreign-ministry-mocks-macron-video","en"
"Sweden to summon Israeli ambassador over Gaza","Mon, 26 May 2025 22:43:47 GMT","The Straits Times","Singapore","COPENHAGEN - Sweden's foreign ministry will summon Israel's ambassador in Stockholm to protest against a lack of humanitarian aid to people in Gaza, Swedish Prime Minister Ulf Kristersson said on Monday.","https://www.straitstimes.com/world/europe/sweden-to-summon-israeli-ambassador-over-gaza","en"
"Trump threatens to steer Harvard grant money to trade schools","Mon, 26 May 2025 22:34:01 GMT","The Straits Times","Singapore","Trump's administration has already suspended more than S$3.3 billion in federal research grants.","https://www.straitstimes.com/world/united-states/trump-threatens-to-steer-harvard-grant-money-to-trade-schools","en"
"Majority of medical equipment supplies at ‘stock zero’ in Gaza, says WHO","Mon, 26 May 2025 22:13:35 GMT","The Straits Times","Singapore","The agency has 51 aid trucks waiting on the Gaza border that have not yet had clearance to enter.","https://www.straitstimes.com/world/middle-east/majority-of-medical-equipment-supplies-at-stock-zero-in-gaza-who-says","en"
"Palestinian official says Hamas agrees to Gaza proposal, Israel dismisses it","Mon, 26 May 2025 21:48:35 GMT","The Straits Times","Singapore","The new proposal sees the release of 10 hostages and 70 days of truce.","https://www.straitstimes.com/world/middle-east/hamas-agrees-to-us-proposal-on-gaza-ceasefire-palestinian-official-says","en"
"US FBI launches new probes into 2023 White House cocaine incident, Dobbs Supreme Court leak","Mon, 26 May 2025 21:43:36 GMT","The Straits Times","Singapore","Previous investigations into both cases ended without identifying who was responsible for the cocaine or the leak.","https://www.straitstimes.com/world/united-states/us-fbi-launches-new-probes-into-2023-white-house-cocaine-incident-dobbs-supreme-court-leak","en"
"Recent Ukraine attacks prove Russia not interested in peace, Denmark says","Mon, 26 May 2025 21:18:51 GMT","The Straits Times","Singapore","HELSINKI - Russia's attacks on Ukraine during the weekend proved that Moscow is not interested in peace, Denmark's Prime Minister Mette Frederiksen said on Monday.","https://www.straitstimes.com/world/europe/recent-ukraine-attacks-prove-russia-not-interested-in-peace-denmark-says","en"
"French farmers bring tractors to Paris to press for looser rules","Mon, 26 May 2025 21:18:41 GMT","The Straits Times","Singapore","PARIS - French farmers disrupted highway traffic around Paris and rallied in front of parliament with their tractors on Monday, protesting against amendments filed by opposition lawmakers to a bill that would loosen environmental regulations on farming.","https://www.straitstimes.com/world/europe/french-farmers-bring-tractors-to-paris-to-press-for-looser-rules","en"
"Ship run aground in Norway should be removed within days: Company","Mon, 26 May 2025 21:12:00 GMT","The Straits Times","Singapore","The NCL Salten sailed up onto shore just metres from a wooden cabin around dawn on May 22.","https://www.straitstimes.com/world/ship-run-aground-in-norway-should-be-removed-within-days-company","en"
"Hamas-led groups execute four for looting aid trucks amid some Gaza dissent","Mon, 26 May 2025 20:48:30 GMT","The Straits Times","Singapore","Aid groups have said that deliveries have been hampered by looting.","https://www.straitstimes.com/world/middle-east/hamas-led-groups-execute-four-for-looting-aid-trucks-amid-some-gaza-dissent","en"
"Saudi Arabia official denies reports of lifting ban on alcohol","Mon, 26 May 2025 20:33:27 GMT","The Straits Times","Singapore","Those who drink alcohol in Saudi Arabia can be punished by deportation, fines or imprisonment.","https://www.straitstimes.com/world/middle-east/saudi-arabia-official-denies-reports-of-lifting-ban-on-alcohol","en"
"French surgeon says deserves no ‘leniency’ after decades of abusing patients","Mon, 26 May 2025 19:35:00 GMT","The Straits Times","Singapore","The verdict is expected on May 28.","https://www.straitstimes.com/world/europe/french-surgeon-tells-sexual-abuse-trial-he-is-not-asking-for-any-leniency","en"
"Scuffles, insults as Israelis celebrate Jerusalem Day under shadow of Gaza war","Mon, 26 May 2025 18:58:38 GMT","The Straits Times","Singapore","The annual ‘Flag March’ commemorates Israeli forces taking east Jerusalem during the 1967 Arab-Israeli war.","https://www.straitstimes.com/world/middle-east/scuffles-insults-as-israelis-celebrate-jerusalem-day-under-shadow-of-gaza-war","en"
"Ukraine confirmed Chinese supplies to 20 Russian military plants, intelligence chief says","Mon, 26 May 2025 18:58:26 GMT","The Straits Times","Singapore","China was said to have supplied gunpowder and components specifically to defence manufacturing industries.","https://www.straitstimes.com/world/europe/ukraine-confirmed-chinese-supplies-to-20-russian-military-plants-intelligence-chief-says","en"
"Kremlin rejects accusations of Russian involvement in UK arson attacks","Mon, 26 May 2025 18:43:59 GMT","The Straits Times","Singapore","MOSCOW - The Kremlin on Monday rejected claims of Russian involvement in arson attacks on houses and a car linked to British Prime Minister Keir Starmer and said that London repeatedly saw the hand of Moscow behind anything bad that happened in Britain.","https://www.straitstimes.com/world/europe/kremlin-rejects-accusations-of-russian-involvement-in-uk-arson-attacks","en"
"Kremlin says work is continuing on Russian draft of peace memorandum","Mon, 26 May 2025 18:43:49 GMT","The Straits Times","Singapore","MOSCOW - Serious work on Russia's proposal for a possible peace deal for the Ukraine war is ongoing and a draft has not yet been submitted, Kremlin spokesman Dmitry Peskov said on Monday.","https://www.straitstimes.com/world/europe/kremlin-says-work-is-continuing-on-russian-draft-of-peace-memorandum","en"
"Austrian court quashes ex-chancellor Kurz's perjury conviction","Mon, 26 May 2025 18:18:39 GMT","The Straits Times","Singapore","VIENNA - An Austrian appeals court said on Monday that it had overturned conservative former chancellor Sebastian Kurz's recent perjury conviction and the resulting eight-month suspended prison sentence.","https://www.straitstimes.com/world/europe/austrian-court-quashes-ex-chancellor-kurzs-perjury-conviction","en"
"Head of US-backed Gaza aid foundation quits as Israeli air strike kills dozens","Mon, 26 May 2025 18:15:00 GMT","The Straits Times","Singapore","30 Palestinians including women and children seeking shelter in school killed","https://www.straitstimes.com/world/middle-east/gaza-aid-foundation-chief-quits-as-further-israeli-air-strikes-kill-dozens","en"
"Palestinians to raise flag at WHO for the first time after vote","Mon, 26 May 2025 18:13:33 GMT","The Straits Times","Singapore","This follows a successful Palestinian bid for membership of the UN General Assembly in 2024.","https://www.straitstimes.com/world/middle-east/palestinians-to-raise-flag-at-who-for-the-first-time-after-vote","en"
"Kendrick Lamar, Taylor Swift compete for American Music Awards","Mon, 26 May 2025 18:08:33 GMT","The Straits Times","Singapore","Super Bowl headliner and Grammy winner Kendrick Lamar faces off with Post Malone, Taylor Swift, Beyonce and other artists on Monday at the American Music Awards in Las Vegas.","https://www.straitstimes.com/world/europe/kendrick-lamar-taylor-swift-compete-for-american-music-awards","en"
"Eleven countries demand EU weakens deforestation law further, document shows","Mon, 26 May 2025 18:03:33 GMT","The Straits Times","Singapore","BRUSSELS -The European Union is facing further pressure from member countries to delay and weaken its upcoming law to restrict deforestation, with 11 governments demanding changes, a document seen by Reuters showed.","https://www.straitstimes.com/world/europe/eleven-countries-demand-eu-weakens-deforestation-law-further-document-shows","en"
"Kremlin on Trump’s remark about Putin being ‘crazy’: There is some emotional overload","Mon, 26 May 2025 17:43:33 GMT","The Straits Times","Singapore","MOSCOW - The Kremlin on Monday said that U.S. President Donald Trump's claim that Vladimir Putin had \""gone absolutely CRAZY\"" might be due to emotional overload, but thanked the U.S. leader for his assistance in launching Ukraine peace negotiations.","https://www.straitstimes.com/world/europe/kremlin-on-trumps-remark-about-putin-being-crazy-there-is-some-emotional-overload","en"
"Russia does not see Vatican as a serious arena for peace talks, sources say","Mon, 26 May 2025 17:25:00 GMT","The Straits Times","Singapore","Russian officials are also unable to fly there due to Western restrictions.","https://www.straitstimes.com/world/russia-does-not-see-vatican-as-a-serious-arena-for-peace-talks-sources-say","en"
"Iran says it could survive if US nuclear talks end without a deal","Mon, 26 May 2025 16:13:25 GMT","The Straits Times","Singapore","DUBAI - Iran would be able to survive if negotiations with the U.S. over its nuclear programme fail to secure a deal, President Masoud Pezeshkian said on Monday, after President Donald Trump described weekend talks with Tehran as \""very good\"".","https://www.straitstimes.com/world/middle-east/iran-says-it-could-survive-if-us-nuclear-talks-end-without-a-deal","en"
"Lesser flamingos lose one of their only four African breeding sites to sewage","Mon, 26 May 2025 16:03:25 GMT","The Straits Times","Singapore","Years of raw sewage spilling into Kamfers Dam made the area too toxic for the birds: Conservationists","https://www.straitstimes.com/world/lesser-flamingos-lose-one-of-their-only-four-african-breeding-sites-to-sewage","en"
"Suriname's ruling party, opposition nearly tied in parliamentary election","Mon, 26 May 2025 15:38:33 GMT","The Straits Times","Singapore","PARAMARIBO - Suriname's ruling party and its top opposition rival won almost the same number of parliamentary seats in an election on Sunday, setting the stage for complex coalition negotiations that will determine who becomes the country's next president.","https://www.straitstimes.com/world/europe/surinames-ruling-party-opposition-nearly-tied-in-parliamentary-election","en"
"France, Vietnam sign Airbus, satellite deals as Macron visits Hanoi","Mon, 26 May 2025 15:06:20 GMT","The Straits Times","Singapore","This is the first by a French president to Vietnam in nearly a decade.","https://www.straitstimes.com/world/france-vietnam-sign-airbus-satellite-deals-as-macron-visits-hanoi","en"
"Russia attacks Ukraine for third night in a row, Ukrainian officials say","Mon, 26 May 2025 14:48:38 GMT","The Straits Times","Singapore","Russia has attacked Ukraine for a third night in a row, Ukrainian regional officials and emergency services said, a day after the biggest aerial attack of the war so far killed at least 12 people and drew condemnation from U.S. President Donald Trump.","https://www.straitstimes.com/world/europe/russia-attacks-ukraine-for-third-night-in-a-row-ukrainian-officials-say","en"
"Misinformation casts shadow on US-China trade truce","Mon, 26 May 2025 14:44:00 GMT","The Straits Times","Singapore","US President Donald Trump’s on-again, off-again tariffs have sent jitters through the world economy.","https://www.straitstimes.com/world/united-states/misinformation-casts-shadow-on-us-china-trade-truce","en"
"Trump forces Switzerland to question its love for farmers","Mon, 26 May 2025 14:29:00 GMT","The Straits Times","Singapore","Mr Trump’s desire to deliver deals however could still help Switzerland.","https://www.straitstimes.com/world/europe/trump-forces-switzerland-to-question-its-love-for-farmers","en"
"Separatists' sit-at-home protests lead to 700 deaths in Nigeria's southeast, report says","Mon, 26 May 2025 14:13:32 GMT","The Straits Times","Singapore","LAGOS - A sit-at-home order by banned separatist group Indigenous People of Biafra in Nigeria's southeast has led to the death of over 700 people in the region over the past four years, an intelligence consultancy said in a new report.","https://www.straitstimes.com/world/separatists-sit-at-home-protests-lead-to-700-deaths-in-nigerias-southeast-report-says","en"
"King Charles heads to Canada in show of support for realm eyed by Trump","Mon, 26 May 2025 14:08:31 GMT","The Straits Times","Singapore","The 76-year-old king is still undergoing cancer treatment.","https://www.straitstimes.com/world/king-charles-heads-to-canada-in-show-of-support-for-realm-eyed-by-trump","en"
"US news anchor delivers news, then baby","Mon, 26 May 2025 13:40:00 GMT","The Straits Times","Singapore","Her water broke in the newsroom bathroom just before the broadcast.","https://www.straitstimes.com/world/united-states/us-news-anchor-delivers-news-then-baby","en"
"Germany rejects accusations towards ambassador after Uganda's military cuts ties","Mon, 26 May 2025 13:38:34 GMT","The Straits Times","Singapore","NAIROBI - Uganda's military has severed all military cooperation with Germany after it accused Berlin's ambassador to Kampala of involvement in \""subversive activities\"" in the East African country, its spokesperson said.","https://www.straitstimes.com/world/europe/germany-rejects-accusations-towards-ambassador-after-ugandas-military-cuts-ties","en"
"Leave all stones unturned, please: Belgian city tells tourists to stop stealing its cobblestones","Mon, 26 May 2025 13:35:26 GMT","The Straits Times","Singapore","About 50 to 70 cobblestones go missing each month.","https://www.straitstimes.com/world/europe/leave-all-stones-unturned-please-belgian-city-tells-tourists-to-stop-stealing-its-cobblestones","en"
"Venezuela ruling party keeps control of legislature amid opposition division","Mon, 26 May 2025 12:03:29 GMT","The Straits Times","Singapore","Venezuela's ruling socialist party held its significant majority in the National Assembly in a Sunday election, winning nearly 83% of votes according to the electoral authority, in a contest boycotted by some opposition leaders amid deep division among parties opposed to the government of President Nicolas Maduro.","https://www.straitstimes.com/world/venezuela-ruling-party-keeps-control-of-legislature-amid-opposition-division","en"
"Head of controversial US-backed Gaza aid group resigns","Mon, 26 May 2025 09:28:21 GMT","The Straits Times","Singapore","He said the organisation could not fulfil its mission in a way that adhered to humanitarian principles.","https://www.straitstimes.com/world/middle-east/head-of-controversial-us-backed-gaza-aid-group-resigns","en"
"Israeli strike kills 20 people in Gaza school housing displaced people, say health authorities","Mon, 26 May 2025 07:38:20 GMT","The Straits Times","Singapore","Medics said the dozens of casualties in the strike included women and children.","https://www.straitstimes.com/world/middle-east/israeli-strike-kills-20-people-in-gaza-school-housing-displaced-people-health-authorities-say","en"
"Trump says US wants to make tanks, not T-shirts","Mon, 26 May 2025 07:13:26 GMT","The Straits Times","Singapore","He also agreed with earlier comments that the US does not need a ""booming textile industry"".","https://www.straitstimes.com/world/united-states/trump-says-us-wants-to-make-tanks-not-t-shirts","en"
"British retailer suspends Labubu toy sales amid safety fears","Mon, 26 May 2025 07:10:00 GMT","The Straits Times","Singapore","The move came after reports of global thefts and queue violence tied to the sought-after collectibles.","https://www.straitstimes.com/world/europe/uk-retailer-suspends-labubu-toy-sales-amid-safety-fears","en"
"Trump says US negotiators had good weekend talks with Iran","Mon, 26 May 2025 07:03:31 GMT","The Straits Times","Singapore","He is seeking a deal to prevent Tehran from developing a nuclear weapon.","https://www.straitstimes.com/world/middle-east/trump-says-us-negotiators-had-good-weekend-talks-with-iran","en"
